question_id,title,description,tags,accepted_answer_id,view_count,creation_date
77311999,AttributeError when Initializing a Custom Decoder Class in TensorFlow with Non-Default Tokenizer,,"python,python-3.x,tensorflow,nlp,huggingface-transformers",77593927,171,1697573588
77292726,Feeding my classifier one document at a time,,"python,machine-learning,scikit-learn,nlp,tfidfvectorizer",77294107,59,1697284742
77278868,Get page number of certain string using pdfminer,,"python,pdf,nlp,pdfminer",77278901,531,1697098665
77265396,How does SQLDatabase Chain work internally? (Langchain),,"nlp,langchain",77266382,1123,1696937491
77258294,CompressFastText pqkmeans does not install,,"python,machine-learning,pip,nlp,fasttext",77270016,85,1696849565
77248199,How to convert Doccano exported JSONL format to spaCy format？,,"nlp,spacy,named-entity-recognition,doccano",77275727,840,1696647305
77248165,What does the vocabulary of a pre-trained / fine-tuned T5 model look like?,,"python,pytorch,nlp,huggingface-transformers",77248234,650,1696646103
77247941,Summarizing n-grams efficiently in Python on big data,,"python,pandas,dataframe,nlp,n-gram",77266470,284,1696639488
77240878,Tokenizing and summarizing Textual data by group efficiently in Python,,"python,pandas,dataframe,nlp,gensim",77242709,62,1696544199
77237818,How to load a huggingface pretrained transformer model directly to GPU?,,"python,nlp,huggingface-transformers",77238046,58331,1696514260
77217287,"In GCP&#39;s DocumentAI, when importing documents via API, is it possible to add a Document Type label?",,"machine-learning,google-cloud-platform,nlp,cloud-document-ai",77303713,617,1696266408
77210103,Why am I getting Hidden size error with PyTorch RNN,,"deep-learning,pytorch,nlp,recurrent-neural-network,one-hot-encoding",77210305,140,1696156480
77210041,troubleshooting PyTorch and Hugging Face&#39;s Pre-trained deBerta Model on Windows 11 with an RTX 3070 GPU,,"pytorch,nlp,gpu,huggingface-transformers,huggingface-tokenizers",77222088,520,1696155310
77182740,Is there a way to measure the margins of a pdf file using image processing in python?,,"python,pdf,image-processing,nlp,html-content-extraction",77183028,679,1695754668
77182311,Question about data_collator throwing a key error in Hugging face,,"python,pytorch,nlp,huggingface-transformers,huggingface-tokenizers",77182746,1011,1695750166
77178058,How to Set Safety Parameters for Text Generation Model in Google Cloud Vertex AI?,,"python,machine-learning,nlp,google-cloud-vertex-ai,large-language-model",77181428,2558,1695715118
77174018,Getting `TypeError: issubclass() arg 1 must be a class` when trying to load `nlp = spacy.load(&quot;en_ner_bc5cdr_md&quot;)`,,"python,tensorflow,machine-learning,nlp,spacy",77174910,863,1695656230
77152888,HuggingFacePipeline and Langchain,,"nlp,langchain,huggingface",77162814,3020,1695321962
77148560,"Python API usage for coreference, semantic graph and NERC",,"python,nlp,named-entity-recognition,freeling",77155932,50,1695285773
77145360,looking for an efficient way to split columns in a text in pandas,,"python,pandas,nlp",77145443,64,1695237278
77123153,How to download the Spacy en_core_web_sm model?,,"machine-learning,debugging,nlp,spacy",77123481,350,1694975985
77116207,What is the correct approach to evaluate Huggingface models on the masked language modeling task?,,"machine-learning,nlp,huggingface-transformers,huggingface",77118113,419,1694833685
77113484,AIML chatbot not learning from aiml file,,"python,nlp,chatbot,aiml",77127051,74,1694790460
77107744,Use NLP (NLTK) to identify groups of phrases in a python dataframe,,"python,pandas,machine-learning,nlp,nltk",77112903,333,1694718289
77094149,How to use both gpus in kaggle for training in pytorch?,,"machine-learning,deep-learning,nlp,gpu,kaggle",77728508,4058,1694580984
77093345,How to get Enhanced++ dependency labels with a java command line in the terminal?,,"java,nlp,stanford-nlp",77212591,84,1694563972
77091208,PyTorch SimCSE loss implementation,,"python,machine-learning,pytorch,nlp",77097615,596,1694537544
77085879,LIME gives this error &quot;classifier models without probability scores&quot; in python,,"python,nlp,lime",77093884,639,1694488453
77084206,How can I enhance morphological information for English models in spaCy?,,"nlp,pos-tagger,spacy-3",77102380,331,1694459134
77082604,error inserting spacy.tokens.span.Span into pandas dataframe,,"python,dataframe,nlp,spacy,spacy-3",77171874,54,1694443289
77074676,ImportError: cannot import name &#39;deprecated&#39; from &#39;typing_extensions&#39;,,"python,pip,nlp,spacy,python-typing",77075595,59372,1694314709
77074094,Dataloader/sampler/collator to create batches based on the sample contents (sequence length),,"python,pytorch,nlp,batch-processing,dataloader",77075337,608,1694294897
77068488,How to Efficiently Convert a Markdown Table to a DataFrame in Python?,,"python,nlp,markdown",77068592,6114,1694190084
77068054,Training difficulties on Transformer seq2seq task using pytorch,,"machine-learning,pytorch,nlp,transformer-model,formal-languages",77069904,489,1694186090
